question,intent,response
What does 'intercropping' mean in farming?,agronomic_practice,"Intercropping is the practice of growing two or more crops simultaneously in the same field, such as planting beans between maize rows."
What is 'intercropping'?,agronomic_practice,"Intercropping is the practice of growing two or more crops simultaneously in the same field, such as planting beans between maize rows."
What do they mean by  intercropping?,agronomic_practice,"Intercropping is the practice of growing two or more crops simultaneously in the same field, such as planting beans between maize rows."
"Can you define ""intercropping""?",agronomic_practice,"Intercropping is the practice of growing two or more crops simultaneously in the same field, such as planting beans between maize rows."
"Can you define the term ""intercropping""?",agronomic_practice,"Intercropping is the practice of growing two or more crops simultaneously in the same field, such as planting beans between maize rows."
What does 'crop rotation' involve?,agronomic_practice,Crop rotation is growing different types of crops in the same area in sequenced seasons to improve soil health and manage pests/diseases.
What is crop rotation?,agronomic_practice,Crop rotation is growing different types of crops in the same area in sequenced seasons to improve soil health and manage pests/diseases.
Why is crop rotation important,agronomic_practice,"Crop rotation in maize farming is crucial for maintaining soil health, controlling pests and diseases, and improving overall yield and sustainability. By rotating different crops in a field, farmers can prevent nutrient depletion, disrupt pest and disease cycles, and improve soil structure"
Why should i practice crop rotation ?,agronomic_practice,"Crop rotation in maize farming is crucial for maintaining soil health, controlling pests and diseases, and improving overall yield and sustainability. By rotating different crops in a field, farmers can prevent nutrient depletion, disrupt pest and disease cycles, and improve soil structure"
Why should a farmer practice crop rotation ?,agronomic_practice,"Crop rotation in maize farming is crucial for maintaining soil health, controlling pests and diseases, and improving overall yield and sustainability. By rotating different crops in a field, farmers can prevent nutrient depletion, disrupt pest and disease cycles, and improve soil structure"
Will climate change bring less rain for my maize?,climate_change_impact,"It is likely that rainfall patterns will become less predictable. Some years might have less rain overall, and the timing of rains within the season could also change, leading to more dry spells during crucial growth stages for your maize."
Will hotter temperatures damage my maize crops?,climate_change_impact,"Yes, higher average temperatures and more frequent very hot days can stress your maize plants, especially during flowering. This can lead to lower yields and poorer quality grain."
Will new pests or diseases become a bigger problem because of climate change?,climate_change_impact,Possibly. Warmer and more humid conditions can favor the spread of certain pests and diseases that weren't as common before. You might need to be more vigilant and learn new ways to manage these threats
How can I grow maize when there are more droughts or floods?,climate_change_impact,"There are ways to adapt. This could include planting maize varieties that are more drought-tolerant, using farming methods that help the soil hold more water, or improving drainage to protect against floods."
How might increased temperatures affect maize pollination?,climate_change_impact,"High temperatures (above 35°C) can damage pollen viability and interfere with silk receptivity, leading to poor pollination and reduced kernel set."
how can increasing temperatures affect maize pollination,climate_change_impact,"High temperatures (above 35°C) can damage pollen viability and interfere with silk receptivity, leading to poor pollination and reduced kernel set."
Explain how when temperature increases it affects maize pollination,climate_change_impact,"High temperatures (above 35°C) can damage pollen viability and interfere with silk receptivity, leading to poor pollination and reduced kernel set."
how is maize pollination affected by Increase in temperatures,climate_change_impact,"High temperatures (above 35°C) can damage pollen viability and interfere with silk receptivity, leading to poor pollination and reduced kernel set."
increase in temperatures affect maize pollination?,climate_change_impact,"High temperatures (above 35°C) can damage pollen viability and interfere with silk receptivity, leading to poor pollination and reduced kernel set."
"increase in temperatures affect maize pollination, how?",climate_change_impact,"High temperatures (above 35°C) can damage pollen viability and interfere with silk receptivity, leading to poor pollination and reduced kernel set."
How does heavy rainfall affect maize?,climate_impact,"Heavy rainfall can cause waterlogging, soil erosion, leaching of nutrients (especially nitrogen), and increase the incidence of certain fungal diseases."
what are the effects of heavy rainfall?,climate_impact,"Heavy rainfall can cause waterlogging, soil erosion, leaching of nutrients (especially nitrogen), and increase the incidence of certain fungal diseases."
What are the results of heavy rainfall?,climate_impact,"Heavy rainfall can cause waterlogging, soil erosion, leaching of nutrients (especially nitrogen), and increase the incidence of certain fungal diseases."
What are the results of too much rainfall?,climate_impact,"Heavy rainfall can cause waterlogging, soil erosion, leaching of nutrients (especially nitrogen), and increase the incidence of certain fungal diseases."
What are the results of too much rain?,climate_impact,"Heavy rainfall can cause waterlogging, soil erosion, leaching of nutrients (especially nitrogen), and increase the incidence of certain fungal diseases."
Is too much rainfall bad?,climate_impact,"Heavy rainfall can cause waterlogging, soil erosion, leaching of nutrients (especially nitrogen), and increase the incidence of certain fungal diseases."
is too much rain bad?,climate_impact,"Heavy rainfall can cause waterlogging, soil erosion, leaching of nutrients (especially nitrogen), and increase the incidence of certain fungal diseases."
is too much rain not good?,climate_impact,"Heavy rainfall can cause waterlogging, soil erosion, leaching of nutrients (especially nitrogen), and increase the incidence of certain fungal diseases."
"Too much rain is bad, right?",climate_impact,"Heavy rainfall can cause waterlogging, soil erosion, leaching of nutrients (especially nitrogen), and increase the incidence of certain fungal diseases."
What are the effects of too much rainfall?,climate_impact,"Heavy rainfall can cause waterlogging, soil erosion, leaching of nutrients (especially nitrogen), and increase the incidence of certain fungal diseases."
What causes lodging (falling over) in maize?,crop_problem,"Lodging can be caused by strong winds/rain, weak stalks (due to K deficiency or disease), root damage (pests, waterlogging), or planting too densely."
What makes maize to fall over?,crop_problem,"It can be due to strong winds/rain, weak stalks (due to K deficiency or disease), root damage (pests, waterlogging), or planting too densely."
Why would Maize fall over?,crop_problem,"It can be due to strong winds/rain, weak stalks (due to K deficiency or disease), root damage (pests, waterlogging), or planting too densely."
Any cause for lodging?,crop_problem,"Lodging can be caused by strong winds/rain, weak stalks (due to K deficiency or disease), root damage (pests, waterlogging), or planting too densely."
can you state the causes for lodging?,crop_problem,"It can be due to strong winds/rain, weak stalks (due to K deficiency or disease), root damage (pests, waterlogging), or planting too densely."
Can you state one reason why water lodging can occur?,crop_problem,It can be due to strong winds/rain.
Can you state two reasons why water lodging can occur?,crop_problem,It can be due to strong winds/rain and planting too densely.
what are the reasons for water lodging to happen?,crop_problem,"It can be due to strong winds/rain, weak stalks (due to K deficiency or disease), root damage (pests, waterlogging), or planting too densely."
Explain why would maize would fall over?,crop_problem,"It can be due to strong winds/rain, weak stalks (due to K deficiency or disease), root damage (pests, waterlogging), or planting too densely."
Explain the reasons why water lodging would occur?,crop_problem,"It can be due to strong winds/rain, weak stalks (due to K deficiency or disease), root damage (pests, waterlogging), or planting too densely."
"If I plant a different crop after my maize, will my next maize harvest be better?",crop_rotation_benefits,"Yes, rotating crops can improve your next maize harvest by improving soil health and reducing pests and diseases that specifically affect maize."
Is it beneficial to rotate maize with groundnuts?,crop_rotation_benefits,"Yes, rotating maize with groundnuts is very beneficial. Groundnuts are legumes, fixing nitrogen in the soil, and they have different pest/disease cycles, helping to break them."
Does planting something other than maize help keep the soil fertile for longer?,crop_rotation_benefits,"Yes, different crops add different nutrients to the soil and use different ones. Rotating them helps maintain a better balance of nutrients, keeping your soil fertile for longer and potentially reducing the need for as much fertilizer."
Can rotating crops help with the weeds in my maize field?,crop_rotation_benefits,"Yes, different crops have different growth habits that can help suppress certain weeds. Rotating can break the cycle of specific weeds that thrive in continuous maize fields."
Will rotating maize with other crops reduce the need for pesticides or other treatments?,crop_rotation_benefits,"It can help. Rotating crops can disrupt the life cycles of maize-specific pests and diseases, potentially reducing their populations and the need for chemical interventions."
Which crops are good partners for maize in a rotation plan?,crop_rotation_examples,"Legumes like beans, soybeans, groundnuts, or cowpeas are excellent for rotation as they fix nitrogen. Root crops like sweet potatoes can also be used."
What is a good crop to rotate with maize?,crop_rotation_examples,"Legumes like beans, soybeans, groundnuts, or cowpeas are excellent for rotation as they fix nitrogen. Root crops like sweet potatoes can also be used."
"Can I plant maize again right after harvesting maize, or is that bad?",crop_rotation_examples,It's generally not the best idea to plant maize right after maize. Rotating with a different type of crop is usually more beneficial for the soil and reduces pest and disease buildup.
"If I plant beans after maize, when should I plant the beans and how long will they take to grow?",crop_rotation_examples,"You would typically plant beans after your maize harvest, usually during the next rainy season. Common beans can take about 2-3 months to mature, depending on the variety and conditions. Groundnuts have a similar timeframe."
"Besides beans, are there any other types of crops that work well in rotation with maize here in Lilongwe?",crop_rotation_examples,"Yes, other good options can include crops like cowpeas (another type of bean), pigeon peas, or even leafy vegetables like mustard greens or amaranth, depending on your market and needs."
"Is it a common practice to plant maize one season, then beans the next?",crop_rotation_examples,"Yes, maize followed by a legume like beans is a very common and beneficial rotation. The beans help put nitrogen back into the soil, which maize needs, and it helps break pest and disease cycles."
What are some simple crops I could plant after harvesting my maize?,crop_rotation_examples,"Some good options for after maize in this region (Lilongwe) include legumes like beans (e.g., common beans, groundnuts), which can also help improve the soil, or sweet potatoes."
What causes Northern Corn Leaf Blight?,disease_identification,"Northern Corn Leaf Blight (NCLB) is a fungal disease causing large (2-15 cm), cigar-shaped, grey-green to tan lesions on leaves."
What are the symptoms of Maize Streak Virus?,disease_identification,"Maize Streak Virus (MSV) causes fine, broken, yellow streaks along the veins, primarily on younger leaves, leading to stunting."
What does Grey Leaf Spot look like on maize leaves?,disease_identification,"Grey Leaf Spot (GLS) causes long, narrow, rectangular, grey-to-tan lesions, parallel to leaf veins, reducing photosynthetic area."
What is 'damping-off' disease in maize seedlings?,disease_identification,"Damping-off is a soil-borne fungal disease that causes seedlings to rot at or below the soil line, leading to them collapsing and dying, resulting in poor stands."
What conditions favour the growth of Ear Rot fungi?,disease_identification,"Ear Rots (like Fusarium, Gibberella, Aspergillus) are fungal diseases favoured by wet weather after silking and often enter through insect or bird damage."
What causes Common Rust in maize?,disease_identification,"Common Rust is a fungal disease appearing as small, circular to elongated, reddish-brown pustules (bumps) on both upper and lower leaf surfaces."
What are the visual cues for Maize Streak Virus infection?,disease_identification,"Maize Streak Virus (MSV) causes fine, broken, yellow streaks along the veins, primarily on younger leaves, leading to stunting."
How do I identify Northern Corn Leaf Blight?,disease_identification,"Northern Corn Leaf Blight (NCLB) is a fungal disease causing large (2-15 cm), cigar-shaped, grey-green to tan lesions on leaves."
What are the first signs of MLN (Maize Lethal Necrosis)?,disease_identification,"Early signs often include mosaic patterns (light/dark green patches) and mottling on leaves, followed by severe yellowing, stunting, and 'dead heart' symptoms."
What causes Ear Rots in maize?,disease_identification,"Ear Rots (like Fusarium, Gibberella, Aspergillus) are fungal diseases favoured by wet weather after silking and often enter through insect or bird damage."
What are the signs of Grey Leaf Spot disease?,disease_identification,"Grey Leaf Spot (GLS) causes long, narrow, rectangular, grey-to-tan lesions, parallel to leaf veins, reducing photosynthetic area."
How do I recognize Common Rust on maize?,disease_identification,"Common Rust is a fungal disease appearing as small, circular to elongated, reddish-brown pustules (bumps) on both upper and lower leaf surfaces."
How do I manage Grey Leaf Spot?,disease_management,"Use GLS-resistant varieties, practice crop rotation (avoiding maize-on-maize), manage residues, and consider fungicides in high-risk situations."
How can I manage 'maize smut' disease?,disease_management,Common smut (causes large galls) is usually not a major economic threat. Management involves using resistant varieties and avoiding plant injury. Carefully remove and destroy galls before they burst.
How can I prevent damping-off?,disease_management,"Use certified, treated seeds. Ensure good drainage, avoid planting too deep, and practice crop rotation to reduce pathogen build-up in the soil."
Can fungicides control MLN?,disease_management,"No, MLN is caused by viruses. Fungicides control fungal diseases, not viral ones. MLN management focuses on resistant varieties and vector control."
Is Common Rust a major concern for maize?,disease_management,"Common Rust rarely causes significant yield loss unless it appears early and is severe on a susceptible hybrid, especially in cooler, humid conditions."
What are the key ways to prevent Ear Rots in maize?,disease_management,"Use resistant hybrids, manage insects (especially borers), harvest timely, and ensure rapid, thorough drying and proper storage."
What steps can I take to control Grey Leaf Spot?,disease_management,"Use GLS-resistant varieties, practice crop rotation (avoiding maize-on-maize), manage residues, and consider fungicides in high-risk situations."
How serious is Common Rust disease for maize yield?,disease_management,"Common Rust rarely causes significant yield loss unless it appears early and is severe on a susceptible hybrid, especially in cooler, humid conditions."
What are prevention measures for NCLB disease?,disease_management,"Use resistant hybrids, practice crop rotation and tillage to manage residue (where the fungus overwinters), and apply fungicides if needed."
How can I prevent NCLB?,disease_management,"Use resistant hybrids, practice crop rotation and tillage to manage residue (where the fungus overwinters), and apply fungicides if needed."
How can I prevent Ear Rots?,disease_management,"Use resistant hybrids, manage insects (especially borers), harvest timely, and ensure rapid, thorough drying and proper storage."
How is Maize Streak Virus spread?,disease_transmission,MSV is spread by leafhoppers (Cicadulina spp.). Management involves controlling these vectors and using resistant varieties.
What spreads Maize Streak Virus between plants?,disease_transmission,MSV is spread by leafhoppers (Cicadulina spp.). Management involves controlling these vectors and using resistant varieties.
What are 'seed-borne' diseases?,disease_transmission,"Seed-borne diseases are caused by pathogens that are carried on or within the seeds. Using certified, disease-free, or treated seeds helps prevent them."
Can you give me an example of a maize disease?,disease_transmission,"A common example of a maize disease in Malawi is Gray Leaf Spot (GLS). You'll recognize it by the long, rectangular, grayish-brown spots that appear on the leaves of the maize plants. These spots often start on the lower leaves and can spread upwards, causing the leaves to dry out and potentially reducing your maize harvest."
What are other examples of maize disease?,disease_transmission,"Other examples of maize diseases include Maize Streak Virus, which causes yellow streaks on leaves, and Leaf Blight, characterized by long, tan spots."
"If one of my maize plants gets a disease, will it spread to the rest of my field?",disease_transmission,"Yes, many maize diseases can spread from one plant to another. This can happen through wind, rain splash, insects, or even by touching healthy plants after touching a sick one."
Can the seeds I use carry diseases that will affect my maize crop?,disease_transmission,"Yes, some diseases can be present on or inside the maize seed itself. Using infected seeds can introduce diseases to your field right from the start. It's important to use healthy, certified seeds if possible."
Do insects play a role in spreading diseases among my maize plants?,disease_transmission,"Yes, many insects can carry disease-causing organisms (like viruses, bacteria, or fungi) from infected plants to healthy ones as they feed or move around the field."
"If I had a disease in my maize field last season, can it still affect my new maize crop this season?",disease_transmission,"Yes, some disease organisms can survive in the soil, on leftover plant debris, or even on weeds from the previous season. If you plant maize in the same field again, these organisms can infect the new crop."
"If my neighbor's maize field has a disease, is there a risk it could spread to my field?",disease_transmission,"Yes, there is a risk. Some diseases can spread through wind carrying spores, through insects that can fly between fields, or even through shared tools or people moving between farms. It's good to be aware of what's happening in nearby fields."
What's an efficient way to dry maize cobs?,drying_methods,Dry cobs on raised platforms or cribs with good airflow. Avoid direct contact with the ground. Turn them regularly until kernels are hard and dry.
How do I dry maize cobs effectively?,drying_methods,Dry cobs on raised platforms or cribs with good airflow. Avoid direct contact with the ground. Turn them regularly until kernels are hard and dry.
What's the best way to dry my maize after harvest to store it safely?,drying_methods,Sun drying on a clean surface is common. Ensure good airflow and stir regularly until the grains are hard and dry.
How dry does my maize need to be before I can store it without it going bad?,drying_methods,The maize grain should be dry enough that you can't easily dent it with your fingernail. Aim for a moisture content of around 13-14%.
Are there any simple structures I can build to help dry my maize better than just on the ground?,drying_methods,"Yes, you can use raised platforms made of bamboo or wire mesh, or even construct a simple raised drying rack to improve airflow and prevent contact with soil."
How long does it usually take to properly dry maize using the sun in Lilongwe's climate?,drying_methods,"It depends on the weather, but it can take several days (3-7 or more) of good sunshine. Make sure to protect it from rain and dew each night."
What is a maize crib?,drying_methods,"A maize crib is a structure, often with slatted walls, designed for drying and temporary storage of maize cobs, allowing air to circulate freely."
Describe a maize crib and its purpose.,drying_methods,"A maize crib is a structure, often with slatted walls, designed for drying and temporary storage of maize cobs, allowing air to circulate freely."
What records should I keep for my maize farm?,farm_management,"Keep records of planting dates, varieties, input costs (seeds, fertilizer, labour), pest/disease issues, rainfall/irrigation, harvest dates, yield, and sales."
What farming activities should I keep records of?,farm_management,"Keep records of planting dates, varieties, input costs (seeds, fertilizer, labour), pest/disease issues, rainfall/irrigation, harvest dates, yield, and sales."
What is a 'knapsack sprayer' used for?,farm_management,"A knapsack sprayer is a portable sprayer carried on the back, used for applying liquid pesticides (insecticides, fungicides, herbicides) or foliar fertilizers."
How do I calibrate my sprayer for herbicide application?,farm_management,"Calibration involves determining your walking speed, spray width, and nozzle output to calculate how much water (and thus herbicide) you apply per unit area, ensuring you apply the correct dose."
What are the main things I need to do to take care of my maize field?,farm_management,"You need to plant your maize at the right time when the rains start reliably. Then, you must regularly remove weeds so they don't take water and nutrients from your maize. Finally, keep an eye out for pests (like stalk borers) and diseases and take action if you see them."
What can I do to take care of my maize field?,farm_management,"You need to plant your maize at the right time when the rains start reliably. Then, you must regularly remove weeds so they don't take water and nutrients from your maize. Finally, keep an eye out for pests (like stalk borers) and diseases and take action if you see them."
How can I use my money and workers wisely on my farm?,farm_management,"Plan what you need to buy (like fertilizer or seeds) in advance to avoid wasting money. When using workers, make sure everyone knows their tasks and works efficiently. Try to do some tasks yourself if you can to save on labor costs."
How can I manage my resources wisely?,farm_management,"Plan what you need to buy (like fertilizer or seeds) in advance to avoid wasting money. When using workers, make sure everyone knows their tasks and works efficiently. Try to do some tasks yourself if you can to save on labor costs."
Should I write anything down about my farm work?,farm_management,"Yes, it's helpful to write down when you planted your maize, what type of seeds you used, how much fertilizer you applied, and how much maize you harvested. This information helps you remember what worked well and what didn't, so you can make better decisions next season and improve your harvest."
should I document the activities happening on my farm?,farm_management,"Yes, it's helpful to write down when you planted your maize, what type of seeds you used, how much fertilizer you applied, and how much maize you harvested. This information helps you remember what worked well and what didn't, so you can make better decisions next season and improve your harvest."
When should I apply NPK fertilizer to maize?,fertilizer_application,"Apply NPK (basal) fertilizer at or soon after planting. A split application, with some N applied later as top-dressing, is often most effective."
When is the right time to apply NPK fertilizer?,fertilizer_application,"Apply NPK (basal) fertilizer at or soon after planting. A split application, with some N applied later as top-dressing, is often most effective."
What is 'broadcasting' fertilizer?,fertilizer_application,Broadcasting means spreading fertilizer evenly over the entire field surface. It's often used before planting and then incorporated into the soil.
How should I apply basal (NPK) fertilizer for best results?,fertilizer_application,"Apply it in a band, about 5 cm to the side and 5 cm below the seed at planting. This avoids 'burning' the seed while placing nutrients near the developing roots."
Can I apply all my fertilizer at planting?,fertilizer_application,"While possible, it's not ideal for nitrogen. Applying all N at planting increases the risk of loss through leaching before the crop can use it. Split application is better."
Is it okay to put all the fertilizer down when planting maize?,fertilizer_application,"While possible, it's not ideal for nitrogen. Applying all N at planting increases the risk of loss through leaching before the crop can use it. Split application is better."
