question,intent,response
What are the differences between Nitrogen and Sulfur deficiency?,nutrient_deficiency_diagnosis,Both cause yellowing. Nitrogen deficiency shows as a V-shape on *older* leaves. Sulfur deficiency causes general yellowing on *younger* leaves.
How can I know if the maize has Nitrogen and Sulfur deficiency?,nutrient_deficiency_diagnosis,Both cause yellowing. Nitrogen deficiency shows as a V-shape on *older* leaves. Sulfur deficiency causes general yellowing on *younger* leaves.
What's the difference between N and S deficiency symptoms?,nutrient_deficiency_diagnosis,Both cause yellowing. Nitrogen deficiency shows as a V-shape on *older* leaves. Sulfur deficiency causes general yellowing on *younger* leaves.
Why is Zinc (Zn) important for maize?,nutrient_role,Zinc is a crucial micronutrient involved in enzyme activity and growth hormone production. Its deficiency can lead to stunting and reduced yield.
Why is Zinc (Zn) necessary for maize?,nutrient_role,Zinc is a crucial micronutrient involved in enzyme activity and growth hormone production. Its deficiency can lead to stunting and reduced yield.
Why is Zinc (Zn) significant for maize?,nutrient_role,Zinc is a crucial micronutrient involved in enzyme activity and growth hormone production. Its deficiency can lead to stunting and reduced yield.
What does Calcium (Ca) do in maize?,nutrient_role,"Calcium is important for cell wall structure, cell division, and root development. Deficiencies are rare unless the soil is very acidic."
What is the function of Calcium (Ca) in maize?,nutrient_role,"Calcium is important for cell wall structure, cell division, and root development. Deficiencies are rare unless the soil is very acidic."
What are the principles of organic maize farming?,organic_farming,"Organic farming avoids synthetic fertilizers/pesticides, focusing on soil health (compost, manure, rotation), biodiversity, and natural pest/disease control."
What happens during organic farming?,organic_farming,"Organic farming avoids synthetic fertilizers/pesticides, focusing on soil health (compost, manure, rotation), biodiversity, and natural pest/disease control."
What does organic farming involve?,organic_farming,"Organic farming avoids synthetic fertilizers/pesticides, focusing on soil health (compost, manure, rotation), biodiversity, and natural pest/disease control."
What is the central idea behind organic maize farming?,organic_farming,"Organic farming avoids synthetic fertilizers/pesticides, focusing on soil health (compost, manure, rotation), biodiversity, and natural pest/disease control."
What is the core idea behind organic maize farming?,organic_farming,"Organic farming avoids synthetic fertilizers/pesticides, focusing on soil health (compost, manure, rotation), biodiversity, and natural pest/disease control."
How can I deal with termites attacking my young maize plants?,pest_control,"Treat seeds with an appropriate insecticide before planting, remove termite mounds near the field, and ensure good field sanitation. You can also use termite baits or drench affected areas."
How do I protect my maize seedlings from cutworms?,pest_control,"Clear fields of weeds before planting, use collars around stems (in small plots), monitor fields at dusk/dawn, and apply recommended soil insecticides if necessary."
How can I manage 'maize weevils' before storage?,pest_control,"Minimize field infestation by harvesting promptly. Ensure cobs are not left in the field, and clean harvesting equipment and transport before bringing grain to storage."
How can I control fall armyworm in my maize field?,pest_control,"Use integrated pest management practices including early planting, regular scouting, and application of recommended insecticides like lambda-cyhalothrin."
How do I manage stem borers organically?,pest_control,"Use 'push-pull' technology with Desmodium and Napier grass, remove and destroy infected plants, and encourage natural predators."
What non-chemical ways can I manage stem borers?,pest_control,"Use 'push-pull' technology with Desmodium and Napier grass, remove and destroy infected plants, and encourage natural predators."
What's an effective way to handle fall armyworm infestation?,pest_control,"Use integrated pest management practices including early planting, regular scouting, and application of recommended insecticides like lambda-cyhalothrin."
What's the strategy for managing maize aphids?,pest_control,"Monitor for aphids, especially on young plants and tassels. Use insecticidal soap or neem oil for light infestations, or recommended systemic insecticides if severe."
Are there natural ways to control fall armyworm?,pest_control,Encourage natural enemies like predators and parasitoids. You can also use biopesticides based on viruses (NPV) or bacteria (Bt).
How can I control fall armyworm in my maize field?,pest_control,"Use integrated pest management practices including early planting, regular scouting, and application of recommended insecticides like lambda-cyhalothrin."
How do I control maize aphids?,pest_control,"Monitor for aphids, especially on young plants and tassels. Use insecticidal soap or neem oil for light infestations, or recommended systemic insecticides if severe."
What are biological control methods for fall armyworm?,pest_control,Encourage natural enemies like predators and parasitoids. You can also use biopesticides based on viruses (NPV) or bacteria (Bt).
Can I use neem oil to manage fall armyworm?,pest_control_method,"Neem oil can act as a repellent and growth disruptor for fall armyworm, especially on young larvae. It's often used in organic farming but may need frequent application."
Explain the 'push-pull' method for controlling maize pests.,pest_control_method,"Push-pull' uses Desmodium intercropped with maize (pushing away pests) and Napier grass as a border crop (pulling pests to it), primarily targeting stem borers and Striga."
What is 'push-pull' technology for pest control?,pest_control_method,"Push-pull' uses Desmodium intercropped with maize (pushing away pests) and Napier grass as a border crop (pulling pests to it), primarily targeting stem borers and Striga."
How can I encourage natural enemies of maize pests?,pest_control_method,"Avoid broad-spectrum insecticides, plant flowering borders or intercrops to provide habitat and food for beneficial insects like ladybugs, lacewings, and wasps."
What is scouting in pest management?,pest_management_management,"Scouting involves regularly walking through your field in a specific pattern to identify pests, diseases, or problems early before they cause significant damage."
What is meant by 'economic threshold' in pest control?,pest_management_management,The economic threshold is the pest population level at which control measures should be applied to prevent the pest from reaching a level where it causes economic losses.
How do I scout for fall armyworm effectively?,pest_management_management,"Walk in a 'W' or 'X' pattern across the field, randomly select 10-20 plants in different spots, and check the whorl and leaves for signs of larvae or damage."
What does 'scouting' mean in the context of maize pests?,pest_management_management,"Scouting involves regularly walking through your field in a specific pattern to identify pests, diseases, or problems early before they cause significant damage."
What is 'Integrated Pest Management' (IPM)?,pest_management_management,"IPM is an approach that combines multiple strategies (cultural, biological, physical, chemical) to manage pests in an effective, economical, and environmentally sound way."
Why is 'thinning' sometimes necessary in maize?,plant_management,"If too many seeds germinate or were planted too close, thinning (removing excess plants) is done to achieve the desired plant population and reduce competition."
why thinning is important in maize?,plant_management,"If too many seeds germinate or were planted too close, thinning (removing excess plants) is done to achieve the desired plant population and reduce competition."
Why do I need to do thinning in maize?,plant_management,"If too many seeds germinate or were planted too close, thinning (removing excess plants) is done to achieve the desired plant population and reduce competition."
What is the importance of thinning in maize?,plant_management,"If too many seeds germinate or were planted too close, thinning (removing excess plants) is done to achieve the desired plant population and reduce competition."
Does planting maize closer together always mean higher yield?,plant_spacing,"Not always. While higher density can increase yield to a point, overcrowding leads to competition for light, water, and nutrients, causing smaller cobs and potential lodging. Follow recommended spacing."
What is 'plant population' and why does it matter?,plant_spacing,"Plant population is the number of maize plants per unit area (e.g., per hectare). It's crucial because it affects competition and is a key determinant of final yield."
What is the ideal spacing for maize planting?,plant_spacing,Use 75 cm between rows and 25 cm between plants within a row for optimal growth and yield.
What row and plant spacing is recommended for maize?,plant_spacing,Use 75 cm between rows and 25 cm between plants within a row for optimal growth and yield.
What is the ideal spacing for maize planting?,plant_spacing,Use 75 cm between rows and 25 cm between plants within a row for optimal growth and yield.
How do I calculate my maize plant population?,plant_spacing,"Count the number of plants in a known length of row (e.g., 10m). Use the formula: (Number of plants / Row length) * (10,000 / Row width in m) = Plants per hectare."
How deep should maize seeds be planted in sandy soil?,planting_depth,"In sandy soils or very dry conditions, plant maize seeds slightly deeper, around 7-8 cm, to reach moisture, but not deeper than 10 cm."
How deep should I plant seeds?,planting_depth,"In sandy soils or very dry conditions, plant maize seeds slightly deeper, around 7-8 cm, to reach moisture, but not deeper than 10 cm."
What is the recommended depth for planting seeds?,planting_depth,"In sandy soils or very dry conditions, plant maize seeds slightly deeper, around 7-8 cm, to reach moisture, but not deeper than 10 cm."
How deep do I need to plant maize seeds?,planting_depth,"In sandy soils or very dry conditions, plant maize seeds slightly deeper, around 7-8 cm, to reach moisture, but not deeper than 10 cm."
How can I protect myself when applying pesticides?,safety_precautions,"Always wear Personal Protective Equipment (PPE): gloves, mask/respirator, eye protection, long sleeves/trousers, and boots. Follow label instructions strictly."
What are some safety tips when operating a maize sheller?,safety_precautions,"Keep hands and loose clothing away from moving parts, ensure guards are in place, operate on stable ground, and don't operate it when tired."
How should I dispose of empty pesticide containers?,safety_precautions,"Triple-rinse the containers (adding rinse water to the spray tank), puncture or crush them so they cannot be reused, and dispose of them according to local regulations, often at designated collection points or by burying safely away from water sources."
What safety gear should I use when spraying pesticides?,safety_precautions,"Always wear Personal Protective Equipment (PPE): gloves, mask/respirator, eye protection, long sleeves/trousers, and boots. Follow label instructions strictly."
What is the benefit of treating maize seeds?,seed_treatment,"Seed treatment protects seedlings from soil-borne fungi (damping-off, root rot) and early-season insect pests, ensuring better crop stand establishment."
Why do I need to treat maize seeds?,seed_treatment,"Seed treatment protects seedlings from soil-borne fungi (damping-off, root rot) and early-season insect pests, ensuring better crop stand establishment."
What is the importance of treating maize seeds?,seed_treatment,"Seed treatment protects seedlings from soil-borne fungi (damping-off, root rot) and early-season insect pests, ensuring better crop stand establishment."
What is the advantage of treating maize seeds?,seed_treatment,"Seed treatment protects seedlings from soil-borne fungi (damping-off, root rot) and early-season insect pests, ensuring better crop stand establishment."
Why should I treat maize seeds before planting?,seed_treatment,"Seed treatment protects seedlings from soil-borne fungi (damping-off, root rot) and early-season insect pests, ensuring better crop stand establishment."
What benefits does mulching offer to maize cultivation?,soil_conservation,"Mulching covers the soil, reducing water evaporation, suppressing weeds, moderating soil temperature, and adding organic matter as it decomposes."
What is agroforestry and how can it help maize farms?,soil_conservation,"Agroforestry integrates trees and shrubs with crops. Trees can act as windbreaks, improve soil fertility (e.g., Faidherbia albida), provide fodder, and diversify income."
How can I build terraces on my sloping maize farm?,soil_conservation,Building terraces requires careful planning and often significant labour or machinery. It involves creating level or gently sloping steps across the hill. It's best to seek technical guidance.
How do tied ridges prevent soil and water loss?,soil_conservation,"Tied ridges create small basins in the field that capture rainwater, preventing runoff, reducing erosion, and increasing water infiltration."
How can I prevent soil erosion in my maize farm?,soil_conservation,"Use contour farming, cover crops, and mulching to reduce soil erosion and maintain fertility."
How can planting trees on my maize farm help?,soil_conservation,"Agroforestry integrates trees and shrubs with crops. Trees can act as windbreaks, improve soil fertility (e.g., Faidherbia albida), provide fodder, and diversify income."
Do cover crops really help increase maize production?,soil_conservation,"Yes, cover crops protect the soil, add organic matter, suppress weeds, and can fix nitrogen (if legumes are used), improving soil health and subsequent maize yields."
How can I prevent soil erosion in my maize farm?,soil_conservation,"Use contour farming, cover crops, and mulching to reduce soil erosion and maintain fertility."
Can cover crops improve my maize yield?,soil_conservation,"Yes, cover crops protect the soil, add organic matter, suppress weeds, and can fix nitrogen (if legumes are used), improving soil health and subsequent maize yields."
How do grass strips help in farming?,soil_conservation,"Grass strips are bands of grass planted along contours. They slow runoff, filter out sediment, and stabilize the soil, reducing erosion."
What are contour bunds used for in farming?,soil_conservation,"Contour bunds are small earthen or stone barriers built along contours on sloping land to slow down water runoff, increase infiltration, and trap eroded soil."
What are grass strips and how do they work?,soil_conservation,"Grass strips are bands of grass planted along contours. They slow runoff, filter out sediment, and stabilize the soil, reducing erosion."
How do tied ridges help conserve soil and water?,soil_conservation,"Tied ridges create small basins in the field that capture rainwater, preventing runoff, reducing erosion, and increasing water infiltration."
How does mulching help in maize farming?,soil_conservation,"Mulching covers the soil, reducing water evaporation, suppressing weeds, moderating soil temperature, and adding organic matter as it decomposes."
What are contour bunds?,soil_conservation,"Contour bunds are small earthen or stone barriers built along contours on sloping land to slow down water runoff, increase infiltration, and trap eroded soil."
What methods can I use to stop soil washing away on my maize farm?,soil_conservation,"Use contour farming, cover crops, and mulching to reduce soil erosion and maintain fertility."
Can planting trees as windbreaks help my maize?,soil_conservation,"Yes, windbreaks reduce wind speed, which lowers soil erosion, decreases water loss through evaporation, and can protect young plants from physical damage."
How can I use vetiver grass for soil conservation?,soil_conservation,"Plant vetiver grass along contours to form dense hedges. Its deep roots hold soil together, and the stiff stems slow down water runoff, trapping sediment."
How can contour farming reduce soil erosion?,soil_conservation,"By ploughing and planting along contours (lines of equal elevation) instead of up and down the slope, each row acts as a mini-barrier, slowing water flow and reducing its power to erode soil."
What is 'liming' and why is it done?,soil_fertility,Liming is the application of calcium carbonate (agricultural lime) to raise the pH of acidic soils. This improves nutrient availability and creates a better environment for maize growth.
What is the role of phosphorus in maize?,soil_fertility,"Phosphorus is crucial for root development, early plant growth, and energy transfer, impacting eventual grain yield."
How can I improve soil fertility for maize farming?,soil_fertility,"Incorporate organic matter such as compost or manure, and apply NPK fertilizer based on soil test recommendations."
How can I make compost tea for my maize?,soil_fertility,Steep well-matured compost in water (often aerated) for 24-48 hours. The liquid 'tea' can be used as a foliar spray or soil drench to provide nutrients and beneficial microbes.
How do I make my own compost?,soil_fertility,"Layer green materials (like weeds, kitchen scraps) with brown materials (like dry leaves, maize stover) in a pit or heap. Keep it moist and turn regularly for a few months."
What is 'green manure' and how can it help maize?,soil_fertility,Green manure involves growing specific crops (often legumes like sunn hemp or velvet beans) and then ploughing them into the soil while still green to add organic matter and nutrients.
What is the role of potassium (K) in maize?,soil_fertility,"Potassium is vital for overall plant health, water regulation, stalk strength (reducing lodging), and disease resistance in maize."
What are 'micronutrients' and are they important for maize?,soil_fertility,"Micronutrients (like Zinc, Boron, Iron, Manganese) are needed in small quantities but are still essential for various maize functions. Deficiencies can limit yield."
How can I prepare compost at home for my farm?,soil_fertility,"Layer green materials (like weeds, kitchen scraps) with brown materials (like dry leaves, maize stover) in a pit or heap. Keep it moist and turn regularly for a few months."
Why is phosphorus important for maize growth?,soil_fertility,"Phosphorus is crucial for root development, early plant growth, and energy transfer, impacting eventual grain yield."
How can I make my soil richer for growing maize?,soil_fertility,"Incorporate organic matter such as compost or manure, and apply NPK fertilizer based on soil test recommendations."
Can I use chicken manure for my maize field?,soil_fertility,"Yes, chicken manure is very rich in nutrients, especially nitrogen. Ensure it is well-composted before application to avoid burning the plants and apply it based on soil needs."
How can I improve soil fertility for maize farming?,soil_fertility,"Incorporate organic matter such as compost or manure, and apply NPK fertilizer based on soil test recommendations."
How can I improve my soil's water-holding capacity?,soil_fertility,"Increase soil organic matter by adding compost, manure, using cover crops, and practicing conservation tillage. Healthy soil structure holds water better."
What is the role of earthworms in soil fertility?,soil_fertility,"Earthworms improve soil structure by burrowing, enhance water infiltration, decompose organic matter, and make nutrients more available to plants. Their presence indicates healthy soil."
How do I conduct a soil test?,soil_testing,"Collect multiple sub-samples (15-20) in a 'W' or 'Z' pattern across your field, mix them thoroughly, take a composite sample, and send it to an accredited soil lab."
How can i do a soil test?,soil_testing,"Collect multiple sub-samples (15-20) in a 'W' or 'Z' pattern across your field, mix them thoroughly, take a composite sample, and send it to an accredited soil lab."
What is the procedure for getting my farm soil tested?,soil_testing,"Collect multiple sub-samples (15-20) in a 'W' or 'Z' pattern across your field, mix them thoroughly, take a composite sample, and send it to an accredited soil lab."
What are the steps for testing soil on my farm?,soil_testing,"Collect multiple sub-samples (15-20) in a 'W' or 'Z' pattern across your field, mix them thoroughly, take a composite sample, and send it to an accredited soil lab."
How do I know if my soil needs lime?,soil_testing,"The most reliable way is through a soil test, which measures the soil pH. A pH below 5.5 generally indicates that liming would be beneficial for maize."
How do I control rats and mice in my maize store?,storage_pest_control,"Make stores rodent-proof (seal holes, use metal guards), keep the area clean, use traps, and as a last resort, use recommended rodenticides carefully."
Can I use ash to control storage pests?,storage_pest_control,"Wood ash can deter some storage pests by creating a physical barrier and a dry environment, but it's generally less effective than hermetic bags or approved insecticides for heavy infestations."
How do I deal with 'larger grain borer' in stored maize?,storage_pest_control,Larger grain borer is very destructive. Hermetic storage (PICS bags) is very effective. Good store hygiene and approved insecticides (Actellic) are also key.
Is wood ash effective against storage pests like weevils?,storage_pest_control,"Wood ash can deter some storage pests by creating a physical barrier and a dry environment, but it's generally less effective than hermetic bags or approved insecticides for heavy infestations."
How can I effectively keep rats out of my maize store?,storage_pest_control,"Make stores rodent-proof (seal holes, use metal guards), keep the area clean, use traps, and as a last resort, use recommended rodenticides carefully."
How can I clean my maize store before putting new grain in?,storage_practices,"Sweep the store thoroughly, remove all old grain and debris, seal any cracks or holes, and consider whitewashing walls or spraying with an approved storage insecticide before loading."
How do I store maize to prevent spoilage?,storage_practices,"Dry maize thoroughly to 13% moisture, store in clean, dry, airtight containers or bags, and keep in a well-ventilated area."
How do I prevent aflatoxin contamination?,storage_practices,"Harvest timely, dry maize quickly and thoroughly (to 13%), avoid insect damage, store in clean, dry, cool places, and consider Aflasafe treatment."
What are PICS bags and how do they help in storage?,storage_practices,"PICS bags (Purdue Improved Crop Storage) are triple-layer hermetic bags that cut off oxygen supply, preventing insect damage during storage without chemicals."
How do I store maize to prevent spoilage?,storage_practices,"Dry maize thoroughly to 13% moisture, store in clean, dry, airtight containers or bags, and keep in a well-ventilated area."
Is it safe to store maize in standard poly bags?,storage_practices,"Yes, woven polypropylene bags are common, but they are not airtight and won't prevent insect damage unless the maize is treated with a storage pesticide."
Can I use plastic drums for storing my maize?,storage_practices,"Yes, clean, dry, food-grade plastic drums with airtight lids can be an effective hermetic storage method, protecting maize from both moisture and pests."
How can I ensure my stored maize is free from aflatoxin?,storage_practices,"Harvest timely, dry maize quickly and thoroughly (to 13%), avoid insect damage, store in clean, dry, cool places, and consider Aflasafe treatment."
What features define a good maize storage facility?,storage_practices,"A good storage structure should be clean, dry, cool, well-ventilated (unless using hermetic), and protected from rain, rodents, birds, and insects."
How do PICS bags protect stored maize?,storage_practices,"PICS bags (Purdue Improved Crop Storage) are triple-layer hermetic bags that cut off oxygen supply, preventing insect damage during storage without chemicals."
Are insecticide-treated storage bags a good option?,storage_practices,"Yes, some bags are pre-treated with insecticides (like deltamethrin). They offer protection but ensure they are approved and handle them carefully."
What's the best way to keep harvested maize from going bad?,storage_practices,"Dry maize thoroughly to 13% moisture, store in clean, dry, airtight containers or bags, and keep in a well-ventilated area."
What are Aflasafe products?,storage_practices,"Aflasafe is a biological control product containing non-toxic strains of Aspergillus flavus. When applied in the field, it outcompetes the toxic strains, significantly reducing aflatoxin contamination."
Can I use insecticide-treated bags for storage?,storage_practices,"Yes, some bags are pre-treated with insecticides (like deltamethrin). They offer protection but ensure they are approved and handle them carefully."
What is the 'Actellic Super' dust used for?,storage_practices,Actellic Super is an insecticide dust often mixed with stored grain like maize to protect it from storage pests such as weevils and larger grain borers. Follow instructions carefully.
How do I know if my storage structure is good enough?,storage_practices,"A good storage structure should be clean, dry, cool, well-ventilated (unless using hermetic), and protected from rain, rodents, birds, and insects."
What's the ideal moisture content for long-term maize storage?,storage_practices,"For safe long-term storage (over 6 months), maize should be dried to 13% moisture content or slightly lower to prevent mould growth and insect activity."
